{
  "protocol_version": 1,
  "request_id": "req-000001",
  "request_digest": "447def19489b1434a208f7e0dd0c6bb378e185a41e053097bb75735c25631fd8",
  "request": {
    "protocol_version": 1,
    "request_id": "req-000001",
    "session_id": "example-session",
    "actor": "codex",
    "shell": "pwsh",
    "working_directory": "C:\\Users\\Alice\\Projects\\demo",
    "script": "Get-ChildItem\n",
    "timeout_seconds": 900,
    "max_output_bytes": 1048576,
    "artifacts": [
      {
        "name": "test-results",
        "paths": ["test-results/**/*.png"]
      }
    ]
  },
  "issue": {
    "number": 42,
    "node_id": "ISSUE_node_42",
    "sender_id": 1001,
    "sender_login": "alice-example"
  },
  "workflow": {
    "repository": "alice/example-control",
    "run_id": 9001,
    "run_attempt": 1,
    "event_name": "issues",
    "event_action": "opened",
    "head_sha": "aaaaaaaaaaaaaaaaaaaaaaaaaaaaaaaaaaaaaaaa"
  },
  "control_source_sha": "bbbbbbbbbbbbbbbbbbbbbbbbbbbbbbbbbbbbbbbb",
  "accepted_at": "2026-09-02T18:00:00Z"
}
